_id,nombre,descripcion,categoria,nivel_requerido,cursos,total_cursos
CERT-MED,Certificado en Ciencias Médicas Fundamentales,Ruta integral de medicina clínica y básica.,medicina,basico,"e81775f3ca4225f72051e671,c4cfbb8a096802f6d67c8720,2b8d6f81430b0b04a8778c53,908b3b0a44ac04d231b4af8d,0ffc361ace5bcdc1fa2bc630,035205d79b6830760b1cadd2,79a45bd7e057571d204b2ae8,02ce056c069ef09aed58ec80",8
CERT-DER,Certificado en Derecho y Ordenamiento Jurídico,Fundamentos del derecho y sus ramas principales.,derecho,basico,"f05d5c0e0af0777370772af6,0cfea62eb6c3d440fa6a4498,0db61feb918427ff44200e61,846050dafa0dd77120e7dbb4,2dc7a9ddcf2b2a44be8de111,303d5409cc6f0bcd1069cf99,bb497b8dd81a4093d54d121e,8005b7db644f5dbc71c3ba12",8
CERT-ECO,Certificado en Economía y Gestión Empresarial,Análisis económico y gestión organizacional.,economia,basico,"fe4c528e4224d60d2936619a,acda3f47a60d53522defabb0,6d92da5dc4ba44e676dc9cfd,b0489cc905165d5f38dc7d84,30bc9836bfa8c80660e71a10,c607cd43b9c7c3b1f4995813,b99d0b178ca639d3eaf034b6,a1f922377f7e4ce7e24cf2af",8
CERT-HUM,Certificado en Humanidades y Ciencias Sociales,Disciplinas humanísticas y pensamiento crítico.,humanidades,basico,"238849a5209d0897aed82e1a,c5b490776ce1bf0c5ef6c478,14b7599f4884f8362f3b0db4,8844bee623e05a218df317f7,209aa11b0b7146d284b7a941,e35dc5a2f83627525c1d40ca,2222b4d45a2c110553a8f8d2",7
CERT-ING,Certificado en Ingeniería Aplicada,De fundamentos a aplicaciones avanzadas de ingeniería.,ingenieria,basico,"d3ae6bf99404105b459e66c4,9cbc95c656074df65ddbc5de,50e8544404a3fea7bb6ebe0c,20244a6538351ee94a93b495,7ba5b2b7222d1ce715ec0f7d,6f91c5db9cd5b8a276976b7b,5736717a7a7cad602b04a2c2",7
CERT-ART,Certificado en Artes Visuales y Expresión Creativa,"Artes plásticas, visuales y contemporáneas.",artes,basico,"dcc68f29383e1bc7cafcb298,71c29a9247ee2e24c17f1ff7,8b2d138d368f00477b1765e6,99132225ee291ee561890f10,9db0d48b379f58eb68a895e3,dc90497269079de65bda58f5,296896ab8193a2b6df01ec04",7
CERT-ARQ,Certificado en Diseño y Planificación Arquitectónica,"Diseño, urbanismo y gestión de obras.",arquitectura,basico,"4480f783451814921e9f33ac,aaea599e90974e9f983efb22,7f6cd6c847779febe2a95b3b,16ad44ef50fa9aaa689296f7,c824d3881a6e052e4aee2279,13148b40aa1203b2d80ea2a1,fb49ba430fb163fc41ec7be0",7
CERT-CEX,Certificado en Ciencias Exactas y Naturales,"Biología molecular, química y física fundamental.",ciencias-exactas,basico,"e4bbb57335ca34b7ddfe594d,a3ae1a7b4d8f81442b2f967d,c386d850924f198de0edbd77,e89059f0275d0e550ff77902,72588080ebabc6ceafbc38ee,ec51a7638a64d32578217059,42d71153cacdc6f8a2b1adfb,5c27ff15dc25940a73d260eb",8
